{
  "$schema": "https://json-schema.org/draft/2020-12/schema",
  "title": "Hunt Chain Project 3 Vulnerability Output",
  "type": "object",
  "required": [
    "schema_version",
    "run",
    "authorization",
    "target",
    "tests",
    "results",
    "evidence",
    "errors",
    "metadata"
  ],
  "properties": {
    "schema_version": {
      "type": "string"
    },
    "run": {
      "type": "object"
    },
    "authorization": {
      "type": "object",
      "required": ["status"],
      "properties": {
        "status": {
          "type": "string",
          "enum": [
            "IN_SCOPE",
            "OUT_OF_SCOPE",
            "UNKNOWN",
            "CONFLICT"
          ]
        }
      },
      "additionalProperties": true
    },
    "target": {
      "type": "object"
    },
    "tests": {
      "type": "array",
      "items": {
        "type": "object"
      }
    },
    "results": {
      "type": "array",
      "items": {
        "type": "object",
        "required": [
          "result_id",
          "test_id",
          "status",
          "confidence"
        ],
        "properties": {
          "result_id": {
            "type": "string"
          },
          "test_id": {
            "type": "string"
          },
          "status": {
            "type": "string",
            "enum": [
              "PASS",
              "FAIL",
              "POTENTIAL",
              "NOT_APPLICABLE",
              "SKIPPED",
              "ERROR"
            ]
          },
          "confidence": {
            "type": "string",
            "enum": [
              "LOW",
              "MEDIUM",
              "HIGH"
            ]
          }
        },
        "additionalProperties": true
      }
    },
    "evidence": {
      "type": "array",
      "items": {
        "type": "object"
      }
    },
    "errors": {
      "type": "array"
    },
    "metadata": {
      "type": "object"
    }
  },
  "additionalProperties": true
}
