{
  "authorization": {
    "metadata": {
      "matched_rules": [
        "GIN-JUICE-SHOP-WEB-001"
      ],
      "winning_rule": "GIN-JUICE-SHOP-WEB-001"
    },
    "reason": "Rule GIN-JUICE-SHOP-WEB-001 matched with specificity 100",
    "source": "ScopeGuard",
    "status": "IN_SCOPE",
    "target": "ginandjuice.shop"
  },
  "errors": [],
  "evidence": [],
  "metadata": {},
  "results": [
    {
      "confidence": "LOW",
      "endpoint_id": "c3f73553-e92c-460d-af72-563fcfaa1c56",
      "errors": [],
      "evidence_ids": [],
      "manual_validation_required": true,
      "metadata": {
        "application_javascript": [
          {
            "detection_method": "application_javascript_dynamic_script_source_flow",
            "script_url": "https://ginandjuice.shop/resources/js/searchLogger.js",
            "sink_markers": [
              "script.src",
              "appendchild(script)"
            ],
            "source_markers": [
              "new url(location)"
            ]
          }
        ],
        "execution_mode": "NORMAL",
        "sinks": [],
        "sources": []
      },
      "observation": "DOM input and sink indicators were observed; browser validation is required.",
      "result_id": "8ae667b7-4de4-4d47-a204-03f313416195",
      "status": "POTENTIAL",
      "target_id": "target:f2aef6b6-befd-4afb-8bf5-27d7ed5a9597",
      "test_id": "XSS-03",
      "title": "DOM-Based XSS Indicators"
    }
  ],
  "run": {
    "execution_mode": "NORMAL",
    "run_id": "23dfaf5ae6724595942a581b09213d59",
    "schema_version": "v1"
  },
  "schema_version": "v1",
  "target": {
    "asset_id": "f2aef6b6-befd-4afb-8bf5-27d7ed5a9597",
    "endpoints": [
      {
        "endpoint_id": "4d157a68-62e4-4d33-b84e-193157dafc9a",
        "metadata": {
          "authorized_seed": true,
          "discovered_from_values": [
            "https://ginandjuice.shop/"
          ],
          "source": "configured_target",
          "sources": [
            "configured_target",
            "html:a:href",
            "web:page"
          ]
        },
        "method": "GET",
        "parameters": [],
        "path": "/",
        "target_id": "target:f2aef6b6-befd-4afb-8bf5-27d7ed5a9597",
        "url": "https://ginandjuice.shop/"
      },
      {
        "endpoint_id": "e1ef97e7-9c57-4f23-ab93-58f965ab8000",
        "metadata": {
          "discovered_by": "web",
          "parent_url": "https://ginandjuice.shop/",
          "source": "html:data-action",
          "sources": [
            "html:data-action"
          ]
        },
        "method": "POST",
        "parameters": [
          "csrf",
          "email"
        ],
        "path": "/catalog/subscribe",
        "target_id": "target:f2aef6b6-befd-4afb-8bf5-27d7ed5a9597",
        "url": "https://ginandjuice.shop/catalog/subscribe"
      },
      {
        "endpoint_id": "7599ac5e-7e4e-4bc7-b985-6ee9ab7ee056",
        "metadata": {
          "discovered_by": "web",
          "parent_url": "https://ginandjuice.shop/",
          "source": "html:link:href",
          "sources": [
            "html:link:href"
          ]
        },
        "method": "GET",
        "parameters": [],
        "path": "/resources/labheader/css/scanMeHeader.css",
        "target_id": "target:f2aef6b6-befd-4afb-8bf5-27d7ed5a9597",
        "url": "https://ginandjuice.shop/resources/labheader/css/scanMeHeader.css"
      },
      {
        "endpoint_id": "8ae01892-701e-4fa6-a4f3-ca1a5801822a",
        "metadata": {
          "discovered_by": "web",
          "parent_url": "https://ginandjuice.shop/",
          "source": "html:link:href",
          "sources": [
            "html:link:href"
          ]
        },
        "method": "GET",
        "parameters": [],
        "path": "/resources/css/labsScanme.css",
        "target_id": "target:f2aef6b6-befd-4afb-8bf5-27d7ed5a9597",
        "url": "https://ginandjuice.shop/resources/css/labsScanme.css"
      },
      {
        "endpoint_id": "e0a8d703-5ad9-4e79-9709-b7e5a0f8e813",
        "metadata": {
          "discovered_by": "web",
          "discovered_from_values": [
            "https://ginandjuice.shop/"
          ],
          "parent_url": "https://ginandjuice.shop/",
          "source": "html:script:src",
          "sources": [
            "html:script:src",
            "javascript:string"
          ]
        },
        "method": "GET",
        "parameters": [],
        "path": "/resources/js/react.development.js",
        "target_id": "target:f2aef6b6-befd-4afb-8bf5-27d7ed5a9597",
        "url": "https://ginandjuice.shop/resources/js/react.development.js"
      },
      {
        "endpoint_id": "a0480c00-9460-4667-bb76-5a1d706d1be7",
        "metadata": {
          "discovered_by": "web",
          "discovered_from_values": [
            "https://ginandjuice.shop/"
          ],
          "parent_url": "https://ginandjuice.shop/",
          "source": "html:script:src",
          "sources": [
            "html:script:src",
            "javascript:string"
          ]
        },
        "method": "GET",
        "parameters": [],
        "path": "/resources/js/react-dom.development.js",
        "target_id": "target:f2aef6b6-befd-4afb-8bf5-27d7ed5a9597",
        "url": "https://ginandjuice.shop/resources/js/react-dom.development.js"
      },
      {
        "endpoint_id": "30f414c8-aa86-456a-9a55-0fb7e6b1ebe0",
        "metadata": {
          "discovered_by": "web",
          "discovered_from_values": [
            "https://ginandjuice.shop/"
          ],
          "parent_url": "https://ginandjuice.shop/",
          "source": "html:script:src",
          "sources": [
            "html:script:src",
            "javascript:string"
          ]
        },
        "method": "GET",
        "parameters": [],
        "path": "/resources/js/angular_1-7-7.js",
        "target_id": "target:f2aef6b6-befd-4afb-8bf5-27d7ed5a9597",
        "url": "https://ginandjuice.shop/resources/js/angular_1-7-7.js"
      },
      {
        "endpoint_id": "daaee120-fe3a-4845-8662-672aae25003e",
        "metadata": {
          "discovered_by": "web",
          "discovered_from_values": [
            "https://ginandjuice.shop/",
            "https://ginandjuice.shop/catalog"
          ],
          "parent_url": "https://ginandjuice.shop/",
          "source": "html:a:href",
          "sources": [
            "html:a:href",
            "html:form:action",
            "javascript:string",
            "web:page"
          ]
        },
        "method": "GET",
        "parameters": [
          "category",
          "searchTerm"
        ],
        "path": "/catalog",
        "target_id": "target:f2aef6b6-befd-4afb-8bf5-27d7ed5a9597",
        "url": "https://ginandjuice.shop/catalog"
      },
      {
        "endpoint_id": "ee695155-b716-4024-98b7-6b147ffab822",
        "metadata": {
          "discovered_by": "web",
          "discovered_from_values": [
            "https://ginandjuice.shop/"
          ],
          "parent_url": "https://ginandjuice.shop/",
          "source": "html:a:href",
          "sources": [
            "html:a:href",
            "javascript:string",
            "web:page"
          ]
        },
        "method": "GET",
        "parameters": [],
        "path": "/blog",
        "target_id": "target:f2aef6b6-befd-4afb-8bf5-27d7ed5a9597",
        "url": "https://ginandjuice.shop/blog"
      },
      {
        "endpoint_id": "bfbce06c-a9d5-409c-8a71-88ac2f233545",
        "metadata": {
          "discovered_by": "web",
          "discovered_from_values": [
            "https://ginandjuice.shop/"
          ],
          "parent_url": "https://ginandjuice.shop/",
          "source": "html:a:href",
          "sources": [
            "html:a:href",
            "javascript:string",
            "web:page"
          ]
        },
        "method": "GET",
        "parameters": [],
        "path": "/about",
        "target_id": "target:f2aef6b6-befd-4afb-8bf5-27d7ed5a9597",
        "url": "https://ginandjuice.shop/about"
      },
      {
        "endpoint_id": "4b876117-b00d-4763-b25c-1db8fae362fd",
        "metadata": {
          "discovered_by": "web",
          "discovered_from_values": [
            "https://ginandjuice.shop/"
          ],
          "parent_url": "https://ginandjuice.shop/",
          "source": "html:a:href",
          "sources": [
            "html:a:href",
            "javascript:string",
            "web:page"
          ]
        },
        "method": "GET",
        "parameters": [],
        "path": "/my-account",
        "target_id": "target:f2aef6b6-befd-4afb-8bf5-27d7ed5a9597",
        "url": "https://ginandjuice.shop/my-account"
      },
      {
        "endpoint_id": "6ae6456a-e9cc-4ada-bbde-fa3be2807738",
        "metadata": {
          "discovered_by": "web",
          "discovered_from_values": [
            "https://ginandjuice.shop/"
          ],
          "parent_url": "https://ginandjuice.shop/",
          "source": "html:a:href",
          "sources": [
            "html:a:href",
            "javascript:string",
            "web:page"
          ]
        },
        "method": "GET",
        "parameters": [],
        "path": "/catalog/cart",
        "target_id": "target:f2aef6b6-befd-4afb-8bf5-27d7ed5a9597",
        "url": "https://ginandjuice.shop/catalog/cart"
      },
      {
        "endpoint_id": "99348752-92e5-4492-a661-37be00ac7550",
        "metadata": {
          "discovered_by": "web",
          "discovered_from_values": [
            "https://ginandjuice.shop/",
            "https://ginandjuice.shop/catalog"
          ],
          "parent_url": "https://ginandjuice.shop/",
          "source": "html:a:href",
          "sources": [
            "html:a:href",
            "javascript:string",
            "web:page"
          ]
        },
        "method": "GET",
        "parameters": [
          "productId"
        ],
        "path": "/catalog/product",
        "target_id": "target:f2aef6b6-befd-4afb-8bf5-27d7ed5a9597",